addr:housenumber,addr:street,name:en,reservation,memorial,title,lgbtq,brand,description,latitude,brand:wikipedia,common_tags,wikipedia,image,wheelchair,checkIn,name,wheelchair:description,addr:postcode,diet:vegan,address,checkOut,note,takeaway,indoor_seating,cuisine,beauty,shop,wikimedia_commons,contact:website,longitude,toilets:wheelchair,diet:vegetarian,fee,hours,stars,changing_table,toilets,url,internet_access,alt,building,outdoor_seating,smoking,diet:gluten_free,opening_hours,type,phone,amenity,old_name,price,tourism,website,amenity,brand,check_date,cuisine,name,opening_hours,shop,meal,Micheline,category,Service,room_facilities,accommodation_type,drink type,music type,Ambiental,price range,private_bath,air_conditioning,bath,balcony,view,kitchen,tv,bed_number,size
,,,,,EYE Film Institute Netherlands,,,"EYE is an institute dedicated to the preservation of film for future generations. Its the successor of the Filmmuseum. It has four film theatres with alternative screenings such as art films. In April the Imagine Film Festival is held here with screenings dedicated to exploitation, cult and lower budget films. Well worth it if you're a fan of the genre.",,,,,,,,,,,,IJpromenade 1,,,,,,,,,,,,,,"Su-Th 10:00-22:00, F-Sa 10:00-23:00",,,,http://www.eyefilm.nl/en,,,,,,,,do,+31 20 589-1400,,,,,,,,,,,,,,,Cultural,,,,,,,,,,,,,,,,
,,,,,Buikslotermeerplein Boven 't Y Shopping Mall,,,,,,,,,,,,,,,Buikslotermeerplein Amsterdam,,,,,,,,,,,,,,,,,,http://www.boventy.nl,,Boven 't Y,,,,,,buy,,,,,,,,,,,,,,,,,,,,,,,,,,,,,,,,
,,,,,Cafe De Pont,,,,,,,,,,,,,,,"Buiksloterweg 3-5, 1031 CC Amsterdam",,,,,,,,,,,,,,,,,,http://cafedepont.nl,,,,,,,,drink,+31 20 636 3388,,,,,,,,,,,,,,,,,,,Wine,Classical,No,,,,,,,,,,
,,,,,Tolhuistuin,,,,,,,,,,,,,,,"Tolhuisweg 5, 1031 CL Amsterdam",,,,,,,,,,,,,,,,,,http://tolhuistuin.nl,,,,,,,,drink,+31 20 7630650,,,,,,,,,,,,,,,,,,,wine,Classical,No,,,,,,,,,,
,,,,,NH Galaxy,,,,,,,,,,,,,,,"Distelkade 21, 1031 XP Amsterdam",,,,,,,,,,,,,,,,,,http://nh-hotels.nl,,,,,,,,sleep,+31 20 634-800,,,,,,,,,,,,,,,,,,,,,,,,,,,,,,,
,,,,,Bastion Hotel Amsterdam Centrum-Noord,,,,,,,,,,,,,,,"Buikslotermeer, Amsterdam",,,,,,,,,,,,,,,,,,http://www.bastionhotels.nl/,,,,,,,,sleep,+31 20 632-3131,,,,,,,,,,,,,,,,,,,,,,,,,,,,,,,
17B,Stationsplein,,,,Amsterdam Centraal railway station,,Chocolate Company,"This beautiful building is an attraction in itself, so if you did not arrive in Amsterdam by train, it is well worth making a special trip to look at the station's facade. The station was built between 1881 and 1889 on three artificial islands. It was designed by Pierre Cuypers who also designed the Rijksmuseum in a similar neo-late-Gothic/Renaissance style. At the time, the project was highly controversial as the new station would effectively cut off the city from the IJ waterfront. Politicians in The Hague pushed it through anyway, and now it is widely regarded as the most beautiful station in the country.",52.378677,,", , , , X, X, , X, X, X, , , , yes: 368, no: 41, only: 25, X",,Amsterdam %286578785683%29.jpg,,,Chocolate Company,,1012AB,,Stationsplein,,,yes,,coffee_shop,,,,,4.899901,,,,,,,,,,,,,,,Mo-Fr 08:00-19:00; Sa-Su 10:00-17:00,see,+31 20 723 2229,cafe,,,,https://www.chocolatecompany.nl,cafe,Chocolate Company,,coffee_shop,Chocolate Company,Mo-Fr 08:00-19:00; Sa-Su 10:00-17:00,,,,,,,,,,,,,,,,,,,,
,,,,,Beurs van Berlage,,,"Take a guided tour and check out the view from the top of the old stock exchange tower. It was built in 1903 (by Hendrik Petrus Berlage) and is considered the beginning of modern Dutch architecture. Costs €3.50, located on Beursplein near Dam Square.",52.375036,,"X, X",,"Beurs van Berlage, Amsterdam, 20.05.2011.jpg",,,R Hotel Info,,,,,,,,,,,gift,,,4.896205,,,,,,,,http://www.beursvanberlage.nl,,,,,,,,see,,,,Price: €3.50,,,,,,,R Hotel Info,,gift,,,,,,,,,,,,,,,,,,,
8,Mozes en Aäronstraat,,,,Royal Palace,,,"The Royal Palace is one of the three official palaces of the Netherlands. It is at the disposal of King Willem-Alexander by the Act of Parliament. It was built in 1651 as the city hall of Amsterdam, in a period known as the Dutch Golden Age. Many school children learn that because of the swampy soil, it was built on no less than 13,569 wooden poles. In 1795, the French Empire of Napoleon Bonaparte invaded the Netherlands, and his brother Louis Napoleon became the first King of Holland in 1806. He acquired the city hall in that year and turned it into a royal palace. It was restored to the original owners when Prince William VI returned to the Netherlands in 1812, but when he was crowned as King William I, he decided that Amsterdam should be the official capital and acquired the city hall once again as a royal palace. This is still a delicate subject among the locals, some of who would like to see the palace returned to Amsterdam. It was completely renovated in 2009. It is mainly used for diplomatic receptions and to welcome visiting heads of state, not as a royal residence.",52.373199,,", , , , X, X, , ",,"Amsterdam, paleis op de Dam 2007-03-26 11.32 .JPG",,,“Russian Treasures” from Kaufman Collection,,1012XZ,,Dam,,,,,,,gift,,,4.891276,,,,Tu-Su 12:00-17:00,,,,http://www.paleisamsterdam.nl/,,Koninklijk Paleis,,,,,,see,+31 20 620-4060,,,€7.50,,,,,,,“Russian Treasures” from Kaufman Collection,,gift,,,,,,,,,,,,,,,,,,,
,,,,,Nationaal Monument,,,"A large spire that functions as a memorial for the victims of World War II. It was designed by architect J.J.P. Oud and revealed at 4 May 1956. Every 4 May, at the Remembrance of the Dead, a ceremony is held here to commemorate all civilians and members of the Dutch armed forces that died in World War II and later armed conflicts.",52.372777,,"X, X, yes: 2234, limited: 983, no: 881",,Amsterdam %286578776785%29.jpg,yes,,SVNRS,,,,Dam Square,,,,,,,gift,,,4.893612,,,,,,,,,,,,,,,,see,+31 20 251-4900,,,,,,,,,,SVNRS,,gift,,,,,,,,,,,,,,,,,,,
371A,Nieuwezijds Voorburgwal,,,,Begijnhof,,,"The Begijnhof is a late medieval enclosed courtyard with the houses of ''beguines'' (Roman Catholic women living in a semi-religious community). It is a very picturesque group of historic buildings, mostly private dwellings. House number 34 is the oldest home in Amsterdam. The courtyard also has a Reformed Church and a hidden Catholic chapel. Surprisingly, it feels like a serene oasis as it is surrounded by the chaotic Kalverstraat and Spui. Entry to the courtyard and surrounding gardens is free, but be careful not to disturb the local community still living here.",52.369447,,", , , , X, X, , , X",,Begijnhof (Amsterdam) P1020929.JPG,,,Exalto,,1012RM,,,,,,,,,books,,,4.889943,,,,,,,,,,,,,,,,see,,,,,,http://recordsandbooks.nl/,,,,,Exalto,,books,,,,,,,,,,,,,,,,,,,
6-H,Muiderstraat,,,,Esnoga,,,"The most prominent synagogue of the city centre, the Esnoga dates back from 1675 and is built in an austere Classicist style. In 1492, Spain expelled its Jewish population as part of the Inquisition, and many fled to Portugal. One hundred years later, their descendants migrated to Amsterdam for its religious freedom. This happened at a time when the Dutch provinces were fighting for independence against Spain. As to avoid being related to the enemy, these Jewish refugees originally from Spain began to refer to themselves as ""Portuguese Jews"". In the early 16th century, the three Jewish communities that existed at the time merged to form the Portuguese Jewish Community of Amsterdam, which still exists today. They were joined by Ashkenazi Jews that arrived from Central and Eastern Europe in the 17th century, together forming the largest Jewish community in Amsterdam and the Netherlands. Shabbat services are held regularly.",52.367663,,", , , , X, X, , ",,EsnogaAmsterdam.jpg,,,E-Blow Vape Shop,,1011RA,,Mr. Visserplein 3,,,,,,,e-cigarette,,,4.904829,,,,,,,,http://www.esnoga.com/en/,,The Portuguese Synagogue,,,,,,see,+31 20 624-5351,,,,,,,,,,E-Blow Vape Shop,,e-cigarette,,,,,,,,,,,,,,,,,,,
12,Dam,New Church,,,Nieuwe Kerk,,,"Used for royal coronations, most recently the crowning of King Willem-Alexander in 2013, and royal weddings, most recently the wedding of crown prince Willem-Alexander to princess Máxima in 2002. Today, the church is no longer used for services but is now a popular exhibition space. With a steep entry price of €10 this is one of the most expensive and least rewarding visitor attractions in the country.",52.373913,,", , , , , yes: 82, no: 18, EUR 24 (2 adults, camper): 2, first hour and restaurant free; €2/hour;€8/day;€5/extra night: 1, X, , , , , , , , X, yes: 2234, limited: 983, no: 881, , , ",nl:Nieuwe Kerk (Amsterdam),Amsterdam Nieuwe Kerk Koorhek.jpg,yes,,Nieuwe Kerk,,1012NP,,Dam,,,,,,,,Category:Nieuwe Kerk (Amsterdam),,4.891715,yes,,,,,,,http://www.nieuwekerk.nl/en/,,,,,,,,see,+31 20 638-6909,museum,,Price: €10,,https://www.nieuwekerk.nl/,museum,,,,Nieuwe Kerk,,,,,,,,,,,,,,,,,,,,,
23,Oudekerksplein,Old Church,,,Oude Kerk,,,"The oldest of the five main churches in the historic centre, and probably the oldest building in Amsterdam. It is right in the heart of the Red Light District. You can climb the tower from April to September on Saturday and Sunday, every half-hour. Also open in the winter by group appointment (maximum 10 people) cost €70 per hour. E-mail for more information.",52.374361,,", , , , , , yes: 82, no: 18, EUR 24 (2 adults, camper): 2, first hour and restaurant free; €2/hour;€8/day;€5/extra night: 1, 2: 21, 8: 2, , X, , , , , , , , , X, , , christian: 2, none: 2, , , X, , X, yes: 2234, limited: 983, no: 881, , , ",nl:Oude Kerk (Amsterdam),Amsterdam Oude Kerk 2008.jpg,yes,,Oude Kerk,,1012GX,,Oudezijds Voorburgwal,,,,,,,,Category:Oude Kerk (Amsterdam),,4.898088,,,,,,,,http://www.oudekerk.nl,,,,,,,Mo-Sa 10:00-18:00; Su 13:00-17:30,see,,church,,Price: €70 per hour,,https://www.oudekerk.nl/,church,,,,Oude Kerk,Mo-Sa 10:00-18:00; Su 13:00-17:30,,,,,,,,,,,,,,,,,,,,
,,,,,Zuiderkerk,,,"Built in 1603-1611. Located on Zuiderkerkhof (""Southern Graveyard""). Now an information centre on housing and planning. You can visit the tower from April to September Monday to Saturday (with guide only) every half-hour, cost €6. Also open in the winter by group appointment (maximum 15 people) cost €70 per hr. E-mail for more information.",52.370258,,"X, X, X",,Amsterdam - Zuiderkerk and Raamgracht.JPG,,,Nili's t-shirt,,,,Zuiderkerkhof 72,,,,,,,clothes,,,4.899837,,,,,,,,http://www.zuiderkerk.amsterdam.nl/,,,,,,,,see,,,,"- €6 for visits to the tower from April to September with a guide every half-hour
- €70 per hour for group appointments in the winter (maximum 15 people)",,https://www.nili4u.com/,,,,,Nili's t-shirt,,clothes,,,,,,,,,,,,,,,,,,,
127,Oude Turfmarkt,Allard Pierson Museum,,,Allard Pierson Museum,,,Archeological museum,52.36877,,", , , , , X, yes: 82, no: 18, EUR 24 (2 adults, camper): 2, first hour and restaurant free; €2/hour;€8/day;€5/extra night: 1, wlan: 431, yes: 64, no: 20, X, , , , , , , , , X, yes: 2234, limited: 983, no: 881, , , ",nl:Allard Pierson Museum,Allard pierson.jpg,yes,,Allard Pierson Museum,,1012GC,,Oude Turfmarkt 127,,,,,,,,Category:Allard Pierson Museum,,4.892939,,,,"M-F 10:00-17:00, Sa-Su 13:00-17:00",,,,http://www.allardpiersonmuseum.nl/en,wlan,,,,,,,see,+31 20 525-2556,museum,,€6.50,,https://allardpierson.nl/,museum,,,,Allard Pierson Museum,,,,,,,,,,,,,,,,,,,,,
92,Kalverstraat,Amsterdam Museum,,,Amsterdam Museum,,,museum of Amsterdams city history,52.370278,,", , , , , X, X, , X, X, , , , , , , X, , , , X, yes: 2234, limited: 983, no: 881, , ",nl:Amsterdam Museum,Amsterdam Binnenplaats meisjes.jpg,yes,,Amsterdam Museum,,1012PH,,Nieuwezijds Voorburgwal 357 or Kalverstraat 92,,"Locatie tijdelijk gesloten vanwege renovatie, verhuisd naar gebouw Hermitage / location temporarily closed for renovation, moved to Hermitage building",,,,,,,,4.890833,yes,,,"M-F 10:00-17:00, Sa-Su 11:00-17:00",,,,http://www.amsterdammuseum.nl/en,,,,,,,Mo-Su 10:00-17:00,see,+31 20 523-1822,museum,Amsterdams Historisch Museum,€10,,https://www.amsterdammuseum.nl/,museum,,,,Amsterdam Museum,Mo-Su 10:00-17:00,,,,,,,,,,,,,,,,,,,,
92,Kalverstraat,Amsterdam Museum,,,Civic Guards Gallery,,,museum of Amsterdams city history,52.370154,,", , , , , X, X, , X, X, , , , , , , X, , , , X, yes: 2234, limited: 983, no: 881, , ",nl:Amsterdam Museum,Schuttersgalerij naar het noorden - Amsterdam - 20014295 - RCE.jpg,yes,,Amsterdam Museum,,1012PH,,Kalverstraat 92,,"Locatie tijdelijk gesloten vanwege renovatie, verhuisd naar gebouw Hermitage / location temporarily closed for renovation, moved to Hermitage building",,,,,,,,4.890678,yes,,,"M-F 10:00-17:00, Sa Su 11:00-17:00",,,,,,Schuttersgalerij,,,,,Mo-Su 10:00-17:00,see,+31 20 523-1822,museum,Amsterdams Historisch Museum,Free,,https://www.amsterdammuseum.nl/,museum,,,,Amsterdam Museum,Mo-Su 10:00-17:00,,,,,,,,,,,,,,,,,,,,
1,Nieuwe Amstelstraat,Jewish Museum,,,Jewish Historical Museum,,,"Jewish Historical Museum. History of the Jewish people, culture and religion.",52.36735,,", , , , , yes: 82, no: 18, EUR 24 (2 adults, camper): 2, first hour and restaurant free; €2/hour;€8/day;€5/extra night: 1, X, , , , , X, , , , X, , X, yes: 2234, limited: 983, no: 881, , , ",nl:Joods Historisch Museum,,yes,,Joods Museum,,1011PL,,Nieuwe Amstelstraat 1,,,,,,,,Category:Joods Historisch Museum,,4.9037,,,,11:00-17:00 daily (except some Jewish holidays),,,,http://www.jhm.nl/english,,Joods Historisch Museum,,,,,Mo-Su 11:00-17:00,see,+31 20 531-0310,yes,,€9,,https://www.jhm.nl,yes,,,,Joods Museum,Mo-Su 11:00-17:00,,,,,,,,,,,,,,,,,,,,
,,,,,Ons' Lieve Heer op Solder,,,"One of the oldest museums in Amsterdam, this is a Catholic church stuffed into the upper stories of a house built in 1663, when Catholics were persecuted and had to disguise their churches. It's amazing to see how they fit worshippers, an organ, and an altar into such a narrow place.",52.374977,,"X, ",,,,,Hotel Vijaya,,,,Oudezijds Voorburgwal 40,,,,,,,,,,4.899215,,,,"M-Sa 10:00-17:00, Su 13:00-17:00",,,,http://www.opsolder.nl/en,,Our Lord in the Attic,,,,,,see,+31 20 624-6604,hotel,,€7,,,hotel,,,,Hotel Vijaya,,,,,,,,,,,,,,,,,,,,,
,,,,,Oranje Voetbal Museum,,,"The legacy of Dutch football started in the 1970s, when Total Football, a revolutionary Dutch style of football, shook the world. The Netherlands is the best football nation that never won the World Cup: it lost the final three times, a national trauma. It did win the European Cup in 1988 lead by star player Marco van Basten. This museum has four floors dedicated to ""Oranje"", and a small cinema that shows a 20-minute film with historic football moments. Especially recommended for Germans.",52.367229,,"X, X, yes: 2234, limited: 983, no: 881",,,yes,,Bubble Tea,,,,Kalverstraat 236,,,,,,,,,,4.89279,,,,Sa Su 11:00-15:00,,,,,,,,,,,,see,+31 20 589-8989,cafe,,€5,,,cafe,,,,Bubble Tea,,,,,,,,,,,,,,,,,,,,,
4,Jodenbreestraat,Rembrandt House,,,Rembrandt House,,,The house where Rembrandt van Rijn lived.,52.369364,,", , , , X, , X, , yes: 82, no: 18, EUR 24 (2 adults, camper): 2, first hour and restaurant free; €2/hour;€8/day;€5/extra night: 1, X, , , , , , , , , X, , , , X, yes: 2234, limited: 983, no: 881, , , , , ",nl:Rembrandthuis,,limited,,Rembrandthuis,Museum not fully accessible - but the exhibitions are accessible by lift,1011NK,,Jodenbreestraat 4,,,,,,,,Category:Rembrandt House Museum,,4.901257,yes,,,10:00-17:00 daily,,,,http://www.rembrandthuis.nl/,,,,,,,Tu-Su 10:00-18:00,see,+31 20 520 0400,museum,,€12.50,,https://www.rembrandthuis.nl/,museum,,,,Rembrandthuis,Tu-Su 10:00-18:00,,,,,,,,,,,,,,,,,,,,
,,,,,Amsterdam Music Theatre,,,"Opera, dance, ballet and other performances. Holds a free lunch concert on Tuesdays.",52.367288,,"X, X",,,,,Hapjeshoek,,,,Waterlooplein 22,,,,,,,,,,4.901023,,,,"M-F 12:00-18:00, Sa Su 12:00-15:00",,,,http://www.het-muziektheater.nl/en/,,Het Muziektheater,,,,,,do,+31 20 551-8117,restaurant,,,,,restaurant,,,,Hapjeshoek,,,,,Theater,,,,,,,,,,,,,,,,
,,,,,NEMO,,,"Above a tunnel overseeing the IJ, NEMO is the largest science museum in the Netherlands. It's a showcase of how scientific phenomena influence daily life. Different sections of the museum deal with technology and engineering, ICT, and bio- and behavioral sciences. This is a place to take kids and is best for those ages 11 and below—teenagers will probably get bored. During summer it has a panorama roof terrace on its roof with deckchairs with free entry.",52.374243,,"X, yes: 10, no: 9, X, yes: 72, no: 22, unisex: 2, , yes: 2234, limited: 983, no: 881",,,limited,,DAK restaurant Nemo,,,,Oosterdok 2,,,,,,,,,,4.91226,yes,,,Tu-Su 10:00-17:00,,yes,yes,http://www.e-nemo.nl/en/,,,,,,,,do,+31 20 531-3233,restaurant,,€11.50,,,restaurant,,,,DAK restaurant Nemo,,,,,Museum,,,,,,,Cheap,,,,,,,,,
173-175,Nieuwe Uilenburgerstraat,Gassan Diamonds,,,Gassan Diamonds,,,"A guided tour is given that's all about the diamond production process and the history of diamond trade in Amsterdam. Diamonds have been traded in Amsterdam for longer than 425 years, and the city used to be known as the ""City of Diamonds"". Tours are given in 27 languages. Of course you can also buy Gassan diamonds here, but you don't have to.",52.369581,,", , , , X, , , X, X, , X",,,,,Gassan Diamonds,,1011LN,,Nieuwe Uilenburgerstraat 173-175,,,,,,,jewelry,,,4.904041,,,,09:00-17:00 daily,,,,http://www.gassan.com,,,,,,,"PH,Mo-Su 09:00-17:00",do,+31 20 622-5333,attraction,,"Free (the tour, not the diamonds)",,https://www.gassan.com/,attraction,,,,Gassan Diamonds,"PH,Mo-Su 09:00-17:00",jewelry,,,Cultural,,,,,,,"Since the activity is free, it falls under the category of ""cheap.""",,,,,,,,,
148,Oudezijds Achterburgwal,Hash Marihuana & Hemp Museum,,,"Hash, Marihuana and Hemp Museum",,,"This is an information centre cq attraction, that does not conform to the museum definitions of Unesco, ICOM and Museumvereniging.",52.371736,,", , , , X, yes: 82, no: 18, EUR 24 (2 adults, camper): 2, first hour and restaurant free; €2/hour;€8/day;€5/extra night: 1, X, , , , , X, , X, yes: 2234, limited: 983, no: 881, , , ",nl:Hash Marihuana & Hemp Museum,,yes,,Hash Marihuana & Hemp Museum,,1012DV,,Oudezijds Achterburgwal 148,,,,,,,,"Category:Hash, Marihuana & Hemp Museum",,4.896966,,,,10:00-23:00 daily,,,,http://www.hashmuseum.com,,,,,,,10:00-22:00,do,+31 20 624-8926,museum,,€9,,https://hashmuseum.com/amsterdam,museum,,,,Hash Marihuana & Hemp Museum,10:00-22:00,,,,Nothing,,,,,,,This activity would be categorized as cheap.,,,,,,,,,
18,Damrak,Sexmuseum,,,Sexmuseum,,,The largest and most prestigious museum for sex art and sex history in the Netherlands. It shows a lot of sex oddities. Only ages 16 and up are allowed entry.,52.37666,,", , , , , yes: 82, no: 18, EUR 24 (2 adults, camper): 2, first hour and restaurant free; €2/hour;€8/day;€5/extra night: 1, X, , , , , , X, , , X, yes: 2234, limited: 983, no: 881, , , ",nl:Sexmuseum,,no,,Venustempel Sexmuseum,,1012LH,,Damrak 18,,,,,,,,Category:Sexmuseum Amsterdam,,4.897235,no,,,09:00-22:00 daily,,,,http://www.sexmuseumamsterdam.nl/index2.html,,,,,,,Mo-Su 09:30-23:30,do,+31 20 622-8376,museum,,€4,,https://sexmuseumamsterdam.nl/,museum,,,,Venustempel Sexmuseum,Mo-Su 09:30-23:30,,,,Museum,,,,,,,Cheap,,,,,,,,,
,,,,,Madame Tussauds,,Peek & Cloppenburg,"The well-known franchise of wax museums also has a branch in Amsterdam. It's a major tourist attraction so expect a steep entry fee and long queues. Unique to this branch are waxworks of famous Dutch people including Willem-Alexander, Beatrix, Tiësto, Rafael van der Vaart, Doutzen Kroes, Vincent van Gogh and Rembrandt.",52.372619,en:Peek & Cloppenburg,"X, , , X, X, yes: 2234, limited: 983, no: 881, , ",,Madam Tussaud.jpg,yes,,Peek & Cloppenburg,,,,Dam 20,,,,,,,clothes,"Category:Peek & Cloppenburg, Amsterdam",,4.892534,,,,10:00-18:30 daily,,,,http://www.madametussauds.com/amsterdam,,,,,,,,do,+31 20 522-1010,,,€22,,,,Peek & Cloppenburg,,,Peek & Cloppenburg,,clothes,,,Museum,,,,,,,"The activity you mentioned, priced at €22, falls under the medium price category.",,,,,,,,,
74,Rokin,,,,Amsterdam Dungeon,,Starbucks,The Amsterdam Dungeon is a horror tour through several dark chambers with live actors. It ends with a roller coaster raging through a real 13th century church.,52.370172,en:Starbucks,", , , , X, X, , , X, X, , X, , , , yes: 368, no: 41, only: 25, , X, yes: 2234, limited: 983, no: 881",,,limited,,Starbucks,,1012KW,,Rokin 78,,,yes,,coffee_shop,,,,,4.892118,yes,,,"11:00-17:00 daily, 24 Dec-8 Jan 10:30-17:30 daily, 2 Jul-4 Sep 11:00-18;00 daily",,,,http://www.the-dungeons.nl,,,,,,,Mo-Su 07:00-22:00,do,+31 20 217 0700,cafe,,€21,,https://www.starbucks.nl,cafe,Starbucks,,coffee_shop,Starbucks,Mo-Su 07:00-22:00,,,,Entertainment,,,,,,,This activity would be categorized as medium in terms of price.,,,,,,,,,
32,Damrak,Orange Tulip,,,Museum of Medieval Torture Instruments,,,"The latest gimmicky tourist attraction near the Centraal Station, it's a small museum about medieval torture and torture devices. In the Middle Ages, torture was a widely known punishment for almost all crimes committed, ranging from rape to murder, and above all for heresy. The type of punishment depended on the victim's crime and social status. The Museum of Medieval Torture Instruments displays over 100 devices used to torture people. Before its make-over, it used to be the Vodka Museum; the vodka shop is still open in the basement with free entry.",52.376089,,", , , , X, , , , , ",,,,,De Oranje Tulp,,1012LK,,Damrak 33,,,,,,,,,,4.89653,,,,09:00-22:00 daily,,,,http://www.tortureamsterdam.com/,,,,,,,,do,+31 20 528-6035,hotel,,€12.50,,,hotel,,,,De Oranje Tulp,,,,,Historic,,,,,,,This activity would be categorized as **medium** based on the price range.,,,,,,,,,
,,,,,Torture Museum,,,"You'd think one museum about torture would be enough, but no, not in Amsterdam. However, this was the first torture museum in the city centre, and is at least somewhat more authentic than the copycat. The museum depicts the history of different torturous techniques used over the centuries. The lighting is bad, the corridors are small and the price an absolute rip-off. You can walk through it in 15-30 minutes.",52.36732,,"nails: 36, tanning: 19, waxing: 8, skin_care: 4, spa: 3, pedicure: 1, *: 1, eyelash;nails: 1, hair_removal;skin_care: 1, cosmetics: 1, X, X",,,,,Amsterdam Nail Art Studio,,,,Singel 449,,,,,,nails,beauty,,,4.890555,,,,10:00-23:00,,,,http://www.torturemuseum.com/,,,,,,,,do,+31 20 320-6642,,,€7,,,,,,,Amsterdam Nail Art Studio,,beauty,,,Museum,,,,,,,This activity would be categorized as cheap.,,,,,,,,,
12,Spui,,,,Spui,,,"Every Friday and Sunday a market is held on the Spui. Friday has books on sale, while Sundays are all about art and antiques.",52.36881,,", , , , X, X, , X, X, yes: 2234, limited: 983, no: 881",,,yes,,American Book Center,,1012XA,,,,,,,,,books,,,4.88971,,,,,,,,http://www.deboekenmarktophetspui.nl/index.php/en/,,,,,,,Mo 12:00-20:00; Tu-We 10:00-20:00; Th 10:00-21:00; Fr-Sa 10:00-20:00; Su 11:00-18:30,buy,+31 20 625 5537,,,,,https://www.abc.nl/,,,,,American Book Center,Mo 12:00-20:00; Tu-We 10:00-20:00; Th 10:00-21:00; Fr-Sa 10:00-20:00; Su 11:00-18:30,books,,,,,,,,,,,,,,,,,,,
1,Waterlooplein,,,,Waterloopleinmarkt,,,"A well-known but fairly overrated market near the city hall. Partly flea market, partly alternative and second hand clothing and accessories. More oriented towards tourists than to locals.",52.36865,,", , , , X, X, , , X, yes: 2234, limited: 983, no: 881",,,no,,Episode,,1011NV,,,,,,,,,second_hand,,,4.90119,,,,M-Sa until about 17:00,,,,,,,,,,,,buy,,,,,,https://www.episode.eu/,,,,,Episode,,second_hand,,,,,,,,,,,,,,,,,,,
12,Spui,,,,The American Book Center,,,"Excellent shop for literature and books in the English language, particularly on American culture.",52.36904,,", , , , X, X, , X, X, yes: 2234, limited: 983, no: 881",,,yes,,American Book Center,,1012XA,,Spui 12,,,,,,,books,,,4.8899,,,,"M 12:00-20:00, Tu-W, F-Sa 10:00-20:00, Th 10:00-21:00, Su 11:00-18:30",,,,http://www.abc.nl/,,,,,,,Mo 12:00-20:00; Tu-We 10:00-20:00; Th 10:00-21:00; Fr-Sa 10:00-20:00; Su 11:00-18:30,buy,+31 20 625 5537,,,,,https://www.abc.nl/,,,,,American Book Center,Mo 12:00-20:00; Tu-We 10:00-20:00; Th 10:00-21:00; Fr-Sa 10:00-20:00; Su 11:00-18:30,books,,,,,,,,,,,,,,,,,,,
,,,,,Athenaeum Boekhandel,,,"One of the most renowned book stores of Amsterdam because of its wide array of fiction and more academic titles. It is very popular among local students; however, their study books are also interesting reading material for non-graduates. They have a particular large selection of books in the humanities, including history, media, language, culture and international relations.",52.36896,,"X, X, X, X, yes: 2234, limited: 983, no: 881",,,no,,Athenaeum Boekhandel,,,,Spui 14-16,,,,,,,books,,,4.88906,,,,"M 11:00-18:00, Tu-W, Sa 09:30-18:00, Th 09:30-21:00, F 9:30-18:30, Su 12:00-17:30",,,,https://www.athenaeum.nl/winkels/athenaeum/,,,,,,,,buy,+31 20 514-1460,,,,,,,,,,Athenaeum Boekhandel,,books,,,,,,,,,,,,,,,,,,,
,,,,,The Book Exchange,,,"A second-hand bookstore specialising in English books, and has a large selection, with an especially good selection of travel writing, detectives, and SF/fantasy.",52.37013,,"X, X, only: 49, yes: 39, no: 13, X, yes: 2234, limited: 983, no: 881",,,no,,The Book Exchange,,,,Kloveniersburgwal 58,,,,,,,books,,,4.89732,,,,"M-Sa 10:00-16:00, Su 11:30-16:00",,,,http://www.bookexchange.nl,,,,,,,,buy,+31 20 626-6266,,,,,,,,,,The Book Exchange,,books,,,,,,,,,,,,,,,,,,,
