21,,,,timorplein,,,,,,,,,,,,amsterdamoost,,,no,,,,stayokay zeeburg,amsterdam,,,,,,,this 480 bed hostel be locate to the east of the city centre in a typical amsterdam neighbourhood amsterdam historic centre be less than 15 minute away by bike or tram the hostel be in the same building a studio k a budget diner and movie theatre,52.36533,,,,bag,,wlan 431 yes 64 no 20 x x yes 2234 limited 983 no 881,,,,,yes,,20140324,tram 14 to zeeburgerdijk,stayokay amsterdam oost,,,,1094cc,,,,,,,,timorplein 21,,,,,,zeeburgstayokaycom,,,,,,,,,,,,,,,,,,,,,,,,,4.9355,,,,,,,,,,,,,,,,,httpwwwstayokaycom,,,,,,,,,,,,,,,,stayokay,sleep,,,,,,,31 20 5513190,,hostel,,,,,httpswwwstayokaycomhostelamsterdamzeeburg,,no,,,number of bed 480 bed location east of the city centre in a typical amsterdam neighbourhood nearby access to amsterdam historic centre in the same building a studio k a budget diner and movie theatre,,,,,,,,,city view,,yes,480,,,
57,,,,jan olphert vaillantlaan,,,,,,,,,,,,amsterdamoost,,,,,,,bb lieve nachten,amsterdam,,,,,rikithair,,,52.36177,,,,bag,,x x x x,,,,,,,20140507,tram 26 to steigereiland,rikit hair,,,,1086xz,,,,,,,,jan olphert vaillantlaan 77,,,,,,mailrikithairnl,,,,,,,,,,,,,,,,,hairdresser,,,,,,yes,,4.97719,,,,,rikithair,,,,,,,,,,,,httplievenachtennl,,,,,,,,,,,,,,,,,sleep,,,,,,,31 20 673 1328,,,,,,,httpswwwrikithairnl,,no,,,,,,,,,,,,,,,,,,
,,,,,,,,,,,,,,,,amsterdamoost,,,,,,,bastion hotel amstel,,,,,,,,comfortable but lack in charm 4 star hotel near overamstel metro 10 minute walk then 10 minute train ride to centraal station but without pedestrian access to the road you have to take your chance with the traffic,52.33366,,,,bag survey,,x,,,,,,,20140324,metro 50 or 51 to overamstel,,,,,,,,,,,,,verlengde van marwijk kooystraat 30,,,,,,,,,,,,1993.0,,,,,,,,,,,,,,,,,,,4.92761,,,,,,,,,,437100000006591.0,,,,,,,httpwwwbastionhotelsnlen,,,,,,,,,,,,,,,,,sleep,,,,,,,31 20 6634567,,hotel,,,,€70,,,no,,,air conditioning tv number bed not specify location near overamstel metro distance to centraal station 10 minute walk then 10 minute train ride lack of pedestrian access to the road,,,,medium,,,,,,,,,,,
,,,,,,,,,,,,,,,,amsterdamoost,,,,,,,mövenpick hotel,,,,,,,,the hotel be locate in the eastern docklands the renew area of the city centre which make it perfect for business or pleasure,52.37801,,,,,,x x x yes 2234 limited 983 no 881,,,,,yes,,,tram 26 to muziekgebouw bimhuis,amsterbike,,,,,,,,,,,,piet heinkade 11,,,,,,hotelamsterdammoevenpickcom,,,,,,,,,,,,,,,,,bicycle,,,,,,,,4.91363,,,,,,,,,,,,,,,,,httpwwwmoevenpickhotelscom,,,,,,,31 20 519 1239,,,,,,,,,,sleep,,,,,,,31 20 5191200,,bicyclerental,,,,€149,,,no,,,view air conditioning,,,,medium,,,,,city view,,,,,,
15,,,,keizersgracht,,,,,,,,,,,,amsterdamjordaan,,,no,,,,brouwersgracht,amsterdam,,,,,,,this canal be sometimes cite a the most beautiful street of amsterdam the name brewer canal refers to the many beer brewery along the canal in the 16th and 17th century nowadays there just one distillery left de ooievaar that have be locate here since 1782 and specializes in dutch jenever and liquor the warehouse here use to store good such a coffee spice and leather but now serve a residential purpose traditional warehouse with the row of spout gable can be found at brouwersgracht 196–188 and at 204 206 208 and 210 also check out the wideopen red shutter at groene valk 192 and grouwe valk 194 geloof brouwersgracht 218 show the typical neck gable design by philip vingboons,52.379431,,,,bag,,x wlan 431 yes 64 no 20 x x,,,,,,,20140211,,sebastians,,,,1015cc,,,,,,,,,,,,,,infohotelsebastiansnl,,,,,,,,,,,,,,,,,,,,,,,,,4.890879,,,,,,,,,,,,,,,,,,,,,,,,31 20 622 6905,,,,,,,,,,see,,,,,,,31 20 423 2342,,hotel,,,,,httpswwwhotelsebastiansnl,,no,,,,,,,,,,,,,,,,,,
45,,,,noordermarkt,,,,,,yes,,,,,,amsterdamjordaan,,,,,,,noorderkerk,amsterdam,,,,,httpswwwfacebookcomcraftedstories102167752152633,,,52.37968,,,,bag,,yes 1 x x x x,,,,,,,20140211,,craft story,,,,1015na,,,,,,,,noordermarkt 48,,,,,,,,,,,,,,,,,,,,,,,gift,,,,,,,,4.886433,,,,,httpswwwinstagramcomcraftedstoriesamsterdam,,,,,,m 10301230 sa 11001300 aproct su 13301730,,,,,,httpwwwnoorderkerkorg,,,,,,,,,,,,,mo 10001800 tu off wefr 10001800 sa 10001700 su off,,,,see,,,,,,,31 20 6266436,,,,,,,httpswwwcraftedstoriesnl,,no,,,,,,,,,,,,,,,,,,
106,,,,westerstraat,,,,,,,pianola museum,,,,,amsterdamjordaan,,,,,,,pianola museum,amsterdam,,,,,,,a museum about pianola from the early 1900s about a dozen be displayed at any one time and every month a piano concert be held,52.378635,,,,,,x x x x x,,,,,,,,tram 3 or 10 to marnixplein,pianola museum,,,,1015mn,,,,,,,,westerstraat 106,,,,,q15124806,infopianolanl,,,,,,,,20230619,,,,,,,,,,,categorypianola museum,,,pianolamuseum,,,4.883573,,,,,,museo de la pianola,,,,,su 14001700,,,,,,httppianolanlpianolamuseumwelcomehtml,,,,,,,,pianola museum,,,,,frsa 13001700 su 13001600,,,,see,,,,,,,31 20 6279624,,museum,,,,€5,httpswwwpianolanl,,no,,,,,,,,,,,,,,,,,,
,,,,,,,,,,,,,,,,amsterdamjordaan,,,,,,,lapjesmarkt,,,,,,,,a specialist market concentrate on sell cloth and material for make clothes curtain etc monday only,,,,,,,,,,,,,,,tram 3 or 10 to marnixplein,,,,,,,,,,,,,westerstraat,,,,,,,,,,,,,,,,,,,,,,,,,,,,,,,,,,,,,,,,,,m 09001300,,,,,,,,,,,,,,,,,,,,,,,buy,,,,,,,,,,,,,,,,no,,,,,,,,,,,,,,,,,,
,,,,,,,,,,,,,,,,amsterdamjordaan,,,,,,,lindengracht,,,,,,,,sell a wide range of good fruit and vegetable fish and various household item saturday only,,,,,,,,,,,,,,,tram 3 or 10 to marnixplein and a short walk along the lijnbaansgracht,,,,,,,,,,,,,,,,,,,,,,,,,,,,,,,,,,,,,,,,,,,,,,,,,,,,,,,sa 09001600,,,,,,,,,,,,,,,,,,,,,,,buy,,,,,,,,,,,,,,,,no,,,,,,,,,,,,,,,,,,
,,,,,,,,,,,,,,,,amsterdamjordaan,,,,,,,noordermarkt,,,,,,,,on monday morning the noordermarkt be a flea market sell fabric record secondhand clothing etc and form part of the lapjesmarkt mention above on saturday the noordermarkt be a biological food market sell a wide range of ecological product like organic fruit and vegetable herb cheese mushroom etc there be also a small flea market,,,,,,,,,,,,,,,tram 3 or 10 to marnixplein and a short walk down the westerstraat,,,,,,,,,,,,,,,,,,,,,,,,,,,,,,,,,,,,,,,,,,,,,,,,,,,,,,,m 09001300 sa 09001600,,,,,,,,,,,,,,,,,,,,,,,buy,,,,,,,,,,,,,,,,no,,,,,,,,,,,,,,,,,,
,,,,,,,,,,,,,,,,amsterdamjordaan,,,,,,,kinnaree,,,,,,,,amaze thai food good atmosphere good service despite be quite busy but the food be why you would come here highly recommend,,,,,,,,,,,,,,,,,,,,,,,,,,,,1e anjeliersdwarsstraat 14,,,,,,,,,,,,,,,,,,,,,,,,,,,,,,,,,,,,,,,,,,,,,,,,httpwwwrestaurantkinnareenl,,,,,,,,,,,,,,,,,eat,,,,,,,31 20 627 71 53,,,,,,,,dinner,no,,,,,,casual,,,,,,,,,,,,
,,,,,,,,,,,,,,,,amsterdamjordaan,,,,,,,mazzo,,,,,,,,this use to be a famous techno club but they turn it into an italian restaurant with a nice modern look you can have breakfast lunch or dinner here on the weekend it smart to make a reservation a it can get pretty busy,,,,,,,,,,,,,,,,,,,,,,,,,,,,rozengracht 114,,,,,,,,,,,,,,,,,,,,,,,,,,,,,,,,,,,,,,,,,,9 be till 1 be,,,,,,,,,,,,,,,,,,,,,,,eat,,,,,,,31 20344 64 02,,,,,,,,dinner,no,,,,,,chic,,,,,,,,,,,,
,,,,,,,,,,,,,,,,amsterdamjordaan,,,,,,,long pura,,,,,,,,indonesian food try the rice table,,,,,,,,,,,,,,,,,,,,,,,,,,,,rozengracht 4648,,,,,,,,,,,,,,,,,,,,,,,,,,,,,,,,,,,,,,,,,,611pm,,,,,,httpwwwrestaurantlongpuracom,,,,,,,,,,,,,,,,,eat,,,,,,,31 20 6238950,,,,,,,,dinner,no,,,,,,casual,,,,,,,,,,,,
,,,,,,,,,,,,,,,,amsterdamjordaan,,,,,,,burgermeester,,,,,,,,yes they serve burger here but dont expect a mcdonalds wannabe they be quality meat fish or vegetarian burger the place be so popular that they open 2 more branch in the city great if you want to have a quick and inexpensive bite order the mini trio so you can taste three different small size burger,,,,,,,,,,,,,,,,,,,,,,,,,,,,elandsgracht 130,,,,,,,,,,,,,,,,,,,,,,,,,,,,,,,,,,,,,,,,,,12002300,,,,,,httpwwwburgermeestereu,,,,,,,,,,,,,,,,,eat,,,,,,,31 900burgers,,,,,,,,lunch,no,,,,,,casual,,,,,,,,,,,,
,,,,,,,,,,,,,,,,amsterdamjordaan,,,,,,,barneys,,,,,,,,a gorgeous brasserie with outside seat which have the best breakfast in amsterdam for very reasonable price their strawberry milkshake be to die for,,,,,,,,,,,,,,,,,,,,,,,,,,,,haarlemerstraat 98,,,,,,,,,,,,,,,,,,,,,,,,,,,,,,,,,,,,,,,,,,,,,,,,,,,,,,,,,,,,,,,,,eat,,,,,,,,,,,,,,,breakfast,no,,,,,,casual,,,,,,,,,,,,
,,,,,,,,,,,,,,,,amsterdamjordaan,,,,,,,de korte prins,,,,,,,,de korte prins be a lunchroom café on the haarlemmerdijk 8 in the heart of the jordaan area in amsterdam the friendly staff serf great bagel roll and sandwich for breakfast and lunch in the afternoon the café be fill with coffee lover who enjoy a rich coffee with a delicious brownie or cheesecake regular often drop by for cooky and muffin takeaway a well,,,,,,,,,,,,,,,,,,,,,,,,,,,,haarlemmerdijk 8,,,,,,,,,,,,,,,,,,,,,,,,,,,,,,,,,,,,,,,,,,open daily from 8 be till 4 pm sat 9 be till 6 pm close on sunday,,,,,,httpwwwdekorteprinsnl,,,,,,,,,,,,,,,,,eat,,,,,,,,,,,,,,,lunch,no,,,,,,casual,,,,,,,,,,,,
,,,,,,,,,,,,,,,,amsterdamjordaan,,,,,,,proust,,,,,,,,proust be a little off the beaten path near the intersection of brouwersgracht and prinsengracht but it worth a visit for the inexpensive and satisfy meal a well a the company it a favourite with local,,,,,,,,,,,,,,,,,,,,,,,,,,,,noordermarkt 4,,,,,,,,,,,,,,,,,,,,,,,,,,,,,,,,,,,,,,,,,,,,,,,,,,,,,,,,,,,,,,,,,eat,,,,,,,31 20 623 91 45,,,,,,,,lunch,no,,,,,,casual,,,,,,,,,,,,
73,,,,haarlemmerstraat,,,,,,,,,,,,amsterdamjordaan,,,,,,,stout,amsterdam,,,,,,,nice and modern barcaferestaurant with young people a customer and mattress on the terrace,52.380168,,,,,,x x yes 72 no 22 unisex 2,,,,,,,,,cafe nobo,,,,1013el,,,,,,,,haarlemmerstraat 73,,,,,,,,,,,,,,,,,,,,,,,,,,,,,,,4.892317,,,,,,,,,,,,,,,,yes,httpwwwrestaurantstoutnl,,,,,,,,,,,,customer,,,,,eat,,,,,,,31 20 616 36 64,,cafe,,,,,,,no,,,,,,chic,,,,,,,,,,,,
,,,,,,,,,,,,,,,,amsterdamjordaan,,,,,,,vliegende schotel,,,,,,,,since green planet be closing you well look for alternative vegetarian hangout believe it or not but vliegende schotel be even well than it australiamoving competitor it have big portion of unbelievably good vegetarian food in an unpretentious but authentic atmosphere minimalistic service and a little walk from the centre but seriously worth it small selection of organic and fair trade wine and a nonsmoking room,,,,,,,,,,,,,,,,,,,,,,,,,,,,nieuwe leliestraat 162,,,,,,,,,,,,,,,,,,,,,,,,,,,,,,,,,,,,,,,,,,,,,,,,,,,,,,,,,,,,,,,,,eat,,,,,,,,,,,,,main €915 daily special €8 bottle of wine €13,,dinner,no,,,,,,casual,cheap,,,,,,,,,,,
,,,,,,,,,,,,,,,,amsterdamjordaan,,,,,,,t smalle,,,,,,,,some say this place have the most beautiful terrace in amsterdam it not big but you sit right beside the canal and if it too cold to sit outside check out the beautifully restore interior in this laidback place,,,,,,,,,,,,,,,,,,,,,,,,,,,,egelantiersgracht 12,,,,,,,,,,,,,,,,,,,,,,,,,,,,,,,,,,,,,,,,,,10000100 friday and saturday till 0200,,,,,,httpwwwtsmallenlsectiondrinken,,,,,,,,,,,,,,,,,drink,,,,,,,31 20 623 96 17,,,,,,,,,no,,,,,none,intimate,,,,,,,,,,,,
,,,,,,,,,,,,,,,,amsterdamjordaan,,,,,,,cafe p 96,,,,,,,,great character at this pub lovely outdoor terrace on a houseboat make for a nice even or afternoon good selection of dutch and belgian beer,,,,,,,,,,,,,,,,,,,,,,,,,,,,prinsengracht 96,,,,,,,,,,,,,,,,,,,,,,,,,,,,,,,,,,,,,,,,,,800am to 100 be,,,,,,httpwwwp96nl,,,,,,,,,,,,,,,,,drink,,,,,,,31 20 622 18 64,,,,,,,,,no,,,,beer,dutchbelgian,casual,,,,,,,,,,,,
,,,,,,,,,,,,,,,,amsterdamjordaan,,,,,,,soundgarden,,,,,,,,top metalgrungypunky pub most relaxed drinking atmosphere in town really nice seclude terrace for drinking beer in the sun can smoke but not buy puff,,,,,,,,,,,,,,,,,,,,,,,,,,,,marnixstraat 166,,,,,,,,,,,,,,,,,,,,,,,,,,,,,,,,,,,,,,,,,,,,,,,,httpwwwcafesoundgardennl,,,,,,,,,,,,,,,,,drink,,,,,,,31 20 620 28 53,,,,,,,,,no,,,,beer,rock,casual,,,,,,,,,,,,
,,,,,,,,,,,,,,,,amsterdamjordaan,,,,,,,bar brandstof,,,,,,,,relatively new bar with a big and often busy terrace get absolutely crowd on friday after work hour,,,,,,,,,,,,,,,,,,,,,,,,,,,,marnixstraat 357 corner with rozengracht,,,,,,,,,,,,,,,,,,,,,,,,,,,,,,,,,,,,,,,,,,monthurs08000100 fri08000300 sat11000300 sun11000100,,,,,,httpwwwbarbrandstofnl,,,,,,,,,,,,,,,,,drink,,,,,,,31 204220813,,,,,,,,,no,,,,beer,pop,casual,,,,,,,,,,,,
,,,,,,,,,,,,,,,,amsterdamjordaan,,,,,,,bar struik,,,,,,,,hangout for the urban 20 and 30somethings every day except friday they serve 1 dish for €750 get really crowd in the weekend,,,,,,,,,,,,,,,,,,,,,,,,,,,,rozengracht 160,,,,,,,,,,,,,,,,,,,,,,,,,,,,,,,,,,,,,,,,,,mon1700100 tue thu 1000 100 fri 1000 300sat 1100 300 sun 1200 100,,,,,,,,,,,,,,,,,,,,,,,drink,,,,,,,31 206254863,,,,,,,,,no,,,,beer,urban,casual,,,,,,,,,,,,
,,,,,,,,,,,,,,,,amsterdamjordaan,,,,,,,cafe chaos,,,,,,,,typical amsterdam brown bar throw your peanut shell on the floor while look at the furniture,,,,,,,,,,,,,,,gps 5236792°487913°,,,,,,,,,,,,,looriegracht 144,,,,,,,,,,,,,,,,,,,,,,,,,,,,,,,,,,,,,,,,,,,,,,,,,,,,,,,,,,,,,,,,,drink,,,,,,,,,,,,,,,,no,,,,beer,jazz,casual,,,,,,,,,,,,
,,,,,,,,,,,,,,,,amsterdamjordaan,,,,,,,korsakoff,,,,,,,,a more alternative rundown but cheap place that often have live music alternative nightspot for fan of metal industrial goth and techno some live music and popular club night a bit off the beaten path but worth it,,,,,,,,,,,,,,,tram rozengracht,,,,,,,,,,,,,lijnbaansgracht 161,,,,,,,,,,,,,,,,,,,,,,,,,,,,,,,,,,,,,,,,,,,,,,,,httpwwwkorsakoffamsterdamnl,,,,,,,,,,,,,,,,,drink,,,,,,,31 20 625 78 54,,,,,,,,,no,,,,beer,alternative,casual,,,,,,,,,,,,
,,,,,,,,,,,,,,,,amsterdamjordaan,,,,,,,maloe melo,,,,,,,,live 50 rockabilly bar drink be cheap and the crowd be mostly dutch rocker but the music be good,,,,,,,,,,,,,,,tram elandsgracht,,,,,,,,,,,,,lijnbaansgracht 163,,,,,,,,,,,,,,,,,,,,,,,,,,,,,,,,,,,,,,,,,,sundaythursday 21000300 fridaysaturday 21000400,,,,,,httpwwwmaloemelocom,,,,,,,,,,,,,,,,,drink,,,,,,,31 20 420 45 92,,,,,,,,,no,,,,beer,rockabilly,casual,,,,,,,,,,,,
,,,,,,,,,,,,,,,,amsterdamjordaan,,,,,,,barneys,,,,,,,,multiple cannabis cup winner know for it internationallyacclaimed marijuana strain,,,,,,,,,,,,,,,,,,,,,,,,,,,,haarlemmerstraat 98,,,,,,,,,,,,,,,,,,,,,,,,,,,,,,,,,,,,,,,,,,,,,,,,httpwwwbarneysbiz,,,,,,,,,,,,,,,,,drink,,,,,,,,,,,,,,,,no,,,,beer,reggae,no,,,,,,,,,,,,
,,,,,,,,,,,,,,,,amsterdamjordaan,,,,,,,shelter jordan hostel,,,,,,,,an alcohol and drugfree christian youth hostel singlesex dormitory include breakfast bed linen,,,,,,,,,,,,,,,tram marnixstraat rozengracht,,,,,,,,,,,,,bloemstraat 179,,,,,,,,,,,,,,,,,,,,,,,,,,,,,,,,,,,,,,,,,,,,,,,,httpwwwshelternl,,,,,,,,,,,,,,,,,sleep,,,,,,,31 20 624 47 17,,hostel,,,,from €19,,,no,,clean,singlesex dormitory bed linen breakfast,,,,cheap,,,no,,,,,,,,
372,,,,marnixstraat,,,,,,,,,,,,amsterdamjordaan,,,,,,,hotel de paris,amsterdam,,,,,,,the hotel have 48 room and be locate near the waterlooplein flee market,52.365775,,,,,,x wlan 431 yes 64 no 20 x x,,,,,,1400,20140211,,krisotel amsterdam,,,,1016xx,,,,,,,,marnixstraat 372,1100,,,,q111875791,reservationkrisotelcom,,,,,,,,,,,,,,,,,,,,,,,,,4.879771,,,,,,,,,,,,,,,,,httphoteldeparisamsterdamnl,,,yes,,,,,,,,,,,,,,sleep,,,,,,,31 20 622 5587,,hotel,,,,,httpskrisotelcom,,no,,,number of room 48 location near waterlooplein flee market,,,,,,,,,city view,,,,,,
75,,,,derde looiersdwarsstraat,,,,,,,,,,,,amsterdamjordaan,,,,,,,hotel de looier amsterdam,amsterdam,,,,,,,the hotel be a 3 star hotel locate near many of the main museum of amsterdam hotel de looier amsterdam be built a a diamond factory in 1886,52.36835,,,,bag,,wlan 431 yes 64 no 20 x x,,,,,,1400,20140211,,de looier,,,,1016vd,,,,,,,,3e looiersdwarsstraat 75,1100,,,,,,,,,,,1890.0,,,,,,,,,,,,,,,,,,httpswwwhoteldelooiercom,4.879661,,,,,,,,,,363100012167468.0,,,3,,,,httpwwwhoteldelooiercom,,,,,,,,,,,,,,,,,sleep,,,,,,,31 20 625 18 55,,hotel,,,,,,,no,,,possible room facility base on the description private bath air conditioning tv,,,,,,,,,,,,,,,
,,,,,,,,,,,,,,,,amsterdamnoord,,,,,,,dadmiraal 1792,,,,,,,,on the bank of the noordhollands kanaal in the north ferry from central station,,,,,,,,,,,,,,,,,,,,,,,,,,,,noordhollandschkanaaldijk 21,,,,,,,,,,,,,,,,,,,,,,,,,,,,,,,,,,,,,,,,,,,,,,,,,,,,,,,,,,,,,,,,,see,,,,,,,,,,,,,,,,no,,,,,,,,,,,,,,,,,,
,,,,,,,,,,,,,,,,amsterdamnoord,,,,,,,buikslotermeerplein boven t y shopping mall,,,,,,,,,,,,,,,,,,,,,,,,,,,,,,,,,,,,buikslotermeerplein amsterdam,,,,,,infoboventynl,,,,,,,,,,,,,,,,,,,,,,,,,,,,,,,,,,,,,,,,,,httpwwwboventynl,,,,boven t y,,,,,,,,,,,,,buy,,,,,,,,,,,,,,,,no,,,,,,,,,,,,,,,,,,
,,,,,,,,,,,,,,,,amsterdamnoord,,,,,,,cafe de pont,,,,,,,,,,,,,,,,,,,,,,,,,,,,,,,,,,,,buiksloterweg 35 1031 cc amsterdam,,,,,,,,,,,,,,,,,,,,,,,,,,,,,,,,,,,,,,,,,,,,,,,,httpcafedepontnl,,,,,,,,,,,,,,,,,drink,,,,,,,31 20 636 3388,,,,,,,,,no,,,,,,,,,,,,,,,,,,
,,,,,,,,,,,,,,,,amsterdamnoord,,,,,,,tolhuistuin,,,,,,,,,,,,,,,,,,,,,,,,,,,,,,,,,,,,tolhuisweg 5 1031 cl amsterdam,,,,,,,,,,,,,,,,,,,,,,,,,,,,,,,,,,,,,,,,,,,,,,,,httptolhuistuinnl,,,,,,,,,,,,,,,,,drink,,,,,,,31 20 7630650,,,,,,,,,no,,,,,,,,,,,,,,,,,,
,,,,,,,,,,,,,,,,amsterdamnoord,,,,,,,nh galaxy,,,,,,,,,,,,,,,,,,,,,,,,,,,,,,,,,,,,distelkade 21 1031 xp amsterdam,,,,,,,,,,,,,,,,,,,,,,,,,,,,,,,,,,,,,,,,,,,,,,,,httpnhhotelsnl,,,,,,,,,,,,,,,,,sleep,,,,,,,31 20 634800,,,,,,,,,no,,,,,,,,,,,,,,,,,,
,,,,,,,,,,,,,,,,amsterdamnoord,,,,,,,bastion hotel amsterdam centrumnoord,,,,,,,,,,,,,,,,,,,,,,,,,,,,,,,,,,,,buikslotermeer amsterdam,,,,,,,,,,,,,,,,,,,,,,,,,,,,,,,,,,,,,,,,,,,,,,,,httpwwwbastionhotelsnl,,,,,,,,,,,,,,,,,sleep,,,,,,,31 20 6323131,,,,,,,,,no,,,,,,,,,,,,,,,,,,
17b,,,,stationsplein,,,,,,,,,,,,amsterdambinnenstad,,,,,,,amsterdam centraal railway station,amsterdam,,,,chocolate company,,,this beautiful building be an attraction in itself so if you do not arrive in amsterdam by train it be well worth make a special trip to look at the station facade the station be built between 1881 and 1889 on three artificial island it be design by pierre cuypers who also design the rijksmuseum in a similar neolategothicrenaissance style at the time the project be highly controversial a the new station would effectively cut off the city from the ij waterfront politician in the hague push it through anyway and now it be widely regard a the most beautiful station in the country,52.378677,,,,bag,,x x x x x yes 368 no 41 only 25 x,,amsterdam 28657878568329jpg,,q108926938,,,20140324,tram or metro centraal station,chocolate company,,,,1012ab,,,,,,,,stationsplein,,,,,,,,,,,yes,,,,,coffeeshop,,,,,,,,,,,,,,,4.899901,,,,,,,,,,,,,,,,,,,,,,,,,,,,,,mofr 08001900 sasu 10001700,,,,see,,,,,,,31 20 723 2229,,cafe,,,,,httpswwwchocolatecompanynl,,no,,,,,,,,,,,,,,,,,,
,,,,,,,,,,,,,,,,amsterdambinnenstad,,,,,,,beurs van berlage,,,,,,,,take a guide tour and check out the view from the top of the old stock exchange tower it be built in 1903 by hendrik petrus berlage and be consider the begin of modern dutch architecture cost €350 locate on beursplein near dam square,52.375036,,,,,,x x,,beurs van berlage amsterdam 20052011jpg,,,,,,tram 4 9 16 or 24 to dam,r hotel info,,,,,,,,,,,,,,,,,,,,,,,,,,,,,,,,,,,gift,,,,,,,,4.896205,,,,,,,,,,,,,,,,,httpwwwbeursvanberlagenl,,,,,,,,,,,,,,,,,see,,,,,,,,,,,,,price €350,,,no,,,,,,,,,,,,,,,,,,
8,,,,mozes en aäronstraat,,,,,,,,,,,,amsterdambinnenstad,,,,,,,royal palace,amsterdam,,,,,,,the royal palace be one of the three official palace of the netherlands it be at the disposal of king willemalexander by the act of parliament it be built in 1651 a the city hall of amsterdam in a period know a the dutch golden age many school child learn that because of the swampy soil it be built on no less than 13569 wooden pole in 1795 the french empire of napoleon bonaparte invade the netherlands and his brother louis napoleon become the first king of holland in 1806 he acquire the city hall in that year and turn it into a royal palace it be restore to the original owner when prince william vi return to the netherlands in 1812 but when he be crown a king william i he decide that amsterdam should be the official capital and acquire the city hall once again a a royal palace this be still a delicate subject among the local some of who would like to see the palace return to amsterdam it be completely renovate in 2009 it be mainly use for diplomatic reception and to welcome visit head of state not a a royal residence,52.373199,,,,bag,,x x,,amsterdam paleis op de dam 20070326 1132 jpg,,,,,20140211,tram 1 2 5 13 or 17 to dam,“ russian treasure ” from kaufman collection,,,,1012xz,,,,,,,,dam,,,,,,,,,,,,,,,,,,,,,,,gift,,,,,,,,4.891276,,,,,,,,,,,tusu 12001700,,,,,,httpwwwpaleisamsterdamnl,,,,koninklijk paleis,,,,,,,,,,,,,see,,,,,,,31 20 6204060,,,,,,€750,,,no,,,,,,,,,,,,,,,,,,
,,,,,,,,,,,,,,,,amsterdambinnenstad,,,,,,,nationaal monument,,,,,,,,a large spire that function a a memorial for the victim of world war ii it be design by architect jjp oud and reveal at 4 may 1956 every 4 may at the remembrance of the dead a ceremony be held here to commemorate all civilian and member of the dutch arm force that die in world war ii and later arm conflict,52.372777,,,,,,x x yes 2234 limited 983 no 881,,amsterdam 28657877678529jpg,,,yes,,,tram 4 9 16 or 24 to dam,svnrs,,,,,,,,,,,,dam square,,,,,,,,,,,,,,,,,,,,,,,gift,,,,,,,,4.893612,,,,,,,,,,,,,,,,,,,,,,,,,,,,,,,,,,see,,,,,,,31 20 2514900,,,,,,,,,no,,,,,,,,,,,,,,,,,,
371a,,,,nieuwezijds voorburgwal,,,,,,,,,,,,amsterdambinnenstad,,,,,,,begijnhof,amsterdam,,,,,,,the begijnhof be a late medieval enclose courtyard with the house of beguine roman catholic woman living in a semireligious community it be a very picturesque group of historic building mostly private dwelling house number 34 be the old home in amsterdam the courtyard also have a reform church and a hidden catholic chapel surprisingly it feel like a serene oasis a it be surround by the chaotic kalverstraat and spui entry to the courtyard and surround garden be free but be careful not to disturb the local community still living here,52.369447,,,,bag,,x x x,,begijnhof amsterdam p1020929jpg,,,,,20140211,tram 1 2 or 5 to spui,exalto,,,,1012rm,,,,,,,,,,,,,,,,,,,,,,,,,,,,,,,book,,,,,,,,4.889943,,,,,,,,,,,,,,,,,,,,,,,,,,,,,,,,,,see,,,,,,,,,,,,,,httprecordsandbooksnl,,no,,,,,,,,,,,,,,,,,,
6h,,,,muiderstraat,,,,,,,,,,,,amsterdambinnenstad,,,,,,,esnoga,amsterdam,,,,,,,the most prominent synagogue of the city centre the esnoga date back from 1675 and be built in an austere classicist style in 1492 spain expel it jewish population a part of the inquisition and many flee to portugal one hundred year later their descendant migrate to amsterdam for it religious freedom this happen at a time when the dutch province be fight for independence against spain a to avoid be related to the enemy these jewish refugee originally from spain begin to refer to themselves a portuguese jew in the early 16th century the three jewish community that exist at the time merge to form the portuguese jewish community of amsterdam which still exists today they be join by ashkenazi jew that arrive from central and eastern europe in the 17th century together form the large jewish community in amsterdam and the netherlands shabbat service be held regularly,52.367663,,,,bag,,x x,,esnogaamsterdamjpg,,,,,20140324,tram 9 or 14 to mr visserplein,eblow vape shop,,,,1011ra,,,,,,,,mr visserplein 3,,,,,,,,,,,,,,,,,,,,,,,ecigarette,,,,,,,,4.904829,,,,,,,,,,,,,,,,,httpwwwesnogacomen,,,,the portuguese synagogue,,,,,,,,,,,,,see,,,,,,,31 20 6245351,,,,,,,,,no,,,,,,,,,,,,,,,,,,
12,,,,dam,,,,,,,new church,,,,,amsterdambinnenstad,,,,neue kirche,,,nieuwe kerk,amsterdam,,,,,,,use for royal coronation most recently the crown of king willemalexander in 2013 and royal wedding most recently the wedding of crown prince willemalexander to princess máxima in 2002 today the church be no longer use for service but be now a popular exhibition space with a steep entry price of €10 this be one of the most expensive and least reward visitor attraction in the country,52.373913,,новая церковь,,,,yes 82 no 18 eur 24 2 adult camper 2 first hour and restaurant free €2hour €8day €5extra night 1 x x yes 2234 limited 983 no 881,nlnieuwe kerk amsterdam,amsterdam nieuwe kerk koorhekjpg,,,yes,,,tram 1 2 5 13 or 17 to dam,nieuwe kerk,,,,1012np,,,,,,,,dam,,,,,q1419675,,,,,,,,,,,,,,,,nl,新教堂,,,categorynieuwe kerk amsterdam,,,,,,4.891715,yes,,,,,,,,,,,,,,,,httpwwwnieuwekerknlen,,,,,,,,nieuwe kerk,,,,,,,,,see,,,,,,,31 20 6386909,,museum,,,,price €10,httpswwwnieuwekerknl,,no,,,,,,,,,,,,,,,,,,
23,,,,oudekerksplein,,,,,,,old church,,,,,amsterdambinnenstad,,,,alte kirche,,,oude kerk,amsterdam,,,,,,,the old of the five main church in the historic centre and probably the old building in amsterdam it be right in the heart of the red light district you can climb the tower from april to september on saturday and sunday every halfhour also open in the winter by group appointment maximum 10 people cost €70 per hour email for more information,52.374361,,аудекерк старая церковь деревянная часовня 1213г,,bag,,yes 82 no 18 eur 24 2 adult camper 2 first hour and restaurant free €2hour €8day €5extra night 1 2 21 8 2 x x christian 2 none 2 x x yes 2234 limited 983 no 881,nloude kerk amsterdam,amsterdam oude kerk 2008jpg,,,yes,,20140211,tram 4 9 16 or 24 to dam metro 51 53 or 54 to nieuwmarkt,oude kerk,,,,1012gx,,,,,,protestant,,oudezijds voorburgwal,,,,,q623558,,3990.0,2.0,,,,1300.0,,,,,,,,,,老教堂,,,categoryoude kerk amsterdam,christian,,,,,4.898088,,,,,,oudekerk,,,,363100012178469.0,,,,,,,httpwwwoudekerknl,,,,,аудекерк,,,oude kerk,,rce,,,mosa 10001800 su 13001730,പഴയ ദൈവാലയം,,,see,,,,,,,,,church,,,,,httpswwwoudekerknl,,no,,,,,,,,,,,,,,,,,,
