addr:housenumber,addr:street,name:en,reservation,memorial,title,lgbtq,brand,description,latitude,brand:wikipedia,common_tags,wikipedia,image,wheelchair,checkIn,name,wheelchair:description,addr:postcode,address,checkOut,note,takeaway,cuisine,beauty,shop,wikimedia_commons,contact:website,longitude,toilets:wheelchair,hours,stars,changing_table,toilets,url,internet_access,alt,smoking,opening_hours,type,phone,amenity,old_name,price,website,meal,Micheline,category,Service,room_facilities,accommodation_type,drink type,music type,Ambiental,price range,private_bath,air_conditioning,bath,balcony,view,kitchen,tv,bed_number,size,indoor/outdoor seating,dietary
173175,Nieuwe Uilenburgerstraat,Gassan Diamonds,,,Gassan Diamonds,,,A guided tour is given thats all about the diamond production process and the history of diamond trade in Amsterdam Diamonds have been traded in Amsterdam for longer than 425 years and the city used to be known as the City of Diamonds Tours are given in 27 languages Of course you can also buy Gassan diamonds here but you dont have to,52.369581,,X   X X  X,,,,,Gassan Diamonds,,1011LN,Nieuwe Uilenburgerstraat 173175,,,,,,jewelry,,,4.904041,,09001700 daily,,,,httpwwwgassancom,,,,PHMoSu 09001700,do,31 20 6225333,attraction,,Free the tour not the diamonds,httpswwwgassancom,,,Cultural,,,,,,,Since the activity is free it falls under the cheap category,,,,,,,,,,,
148,Oudezijds Achterburgwal,Hash Marihuana  Hemp Museum,,,Hash Marihuana and Hemp Museum,,,This is an information centre cq attraction that does not conform to the museum definitions of Unesco ICOM and Museumvereniging,52.371736,,X yes 82 no 18 EUR 24 2 adults camper 2 first hour and restaurant free €2hour€8day€5extra night 1 X     X  X yes 2234 limited 983 no 881,nlHash Marihuana  Hemp Museum,,yes,,Hash Marihuana  Hemp Museum,,1012DV,Oudezijds Achterburgwal 148,,,,,,,CategoryHash Marihuana  Hemp Museum,,4.896966,,10002300 daily,,,,httpwwwhashmuseumcom,,,,10002200,do,31 20 6248926,museum,,€9,httpshashmuseumcomamsterdam,,,,,,,,,,The activity is categorized as cheap,,,,,,,,,,,
18,Damrak,Sexmuseum,,,Sexmuseum,,,The largest and most prestigious museum for sex art and sex history in the Netherlands It shows a lot of sex oddities Only ages 16 and up are allowed entry,52.37666,,yes 82 no 18 EUR 24 2 adults camper 2 first hour and restaurant free €2hour€8day€5extra night 1 X      X   X yes 2234 limited 983 no 881,nlSexmuseum,,no,,Venustempel Sexmuseum,,1012LH,Damrak 18,,,,,,,CategorySexmuseum Amsterdam,,4.897235,no,09002200 daily,,,,httpwwwsexmuseumamsterdamnlindex2html,,,,MoSu 09302330,do,31 20 6228376,museum,,€4,httpssexmuseumamsterdamnl,,,Museum,,,,,,,This activity is categorized as cheap,,,,,,,,,,,
,,,,,Madame Tussauds,,Peek  Cloppenburg,The wellknown franchise of wax museums also has a branch in Amsterdam Its a major tourist attraction so expect a steep entry fee and long queues Unique to this branch are waxworks of famous Dutch people including WillemAlexander Beatrix Tiësto Rafael van der Vaart Doutzen Kroes Vincent van Gogh and Rembrandt,52.372619,enPeek  Cloppenburg,X   X X yes 2234 limited 983 no 881,,Madam Tussaudjpg,yes,,Peek  Cloppenburg,,,Dam 20,,,,,,clothes,CategoryPeek  Cloppenburg Amsterdam,,4.892534,,10001830 daily,,,,httpwwwmadametussaudscomamsterdam,,,,,do,31 20 5221010,,,€22,,,,Museum,,,,,,,This activity would be categorized as mediumpriced,,,,,,,,,,,
74,Rokin,,,,Amsterdam Dungeon,,Starbucks,The Amsterdam Dungeon is a horror tour through several dark chambers with live actors It ends with a roller coaster raging through a real 13th century church,52.370172,enStarbucks,X X   X X  X    yes 368 no 41 only 25  X yes 2234 limited 983 no 881,,,limited,,Starbucks,,1012KW,Rokin 78,,,yes,coffeeshop,,,,,4.892118,yes,11001700 daily 24 Dec8 Jan 10301730 daily 2 Jul4 Sep 11001800 daily,,,,httpwwwthedungeonsnl,,,,MoSu 07002200,do,31 20 217 0700,cafe,,€21,httpswwwstarbucksnl,,,Interactive,,,,,,,This activity would be categorized as medium in terms of price,,,,,,,,,,,
32,Damrak,Orange Tulip,,,Museum of Medieval Torture Instruments,,,The latest gimmicky tourist attraction near the Centraal Station its a small museum about medieval torture and torture devices In the Middle Ages torture was a widely known punishment for almost all crimes committed ranging from rape to murder and above all for heresy The type of punishment depended on the victims crime and social status The Museum of Medieval Torture Instruments displays over 100 devices used to torture people Before its makeover it used to be the Vodka Museum the vodka shop is still open in the basement with free entry,52.376089,,X,,,,,De Oranje Tulp,,1012LK,Damrak 33,,,,,,,,,4.89653,,09002200 daily,,,,httpwwwtortureamsterdamcom,,,,,do,31 20 5286035,hotel,,€1250,,,,Historic,,,,,,,This activity would be categorized as medium in terms of pricing,,,,,,,,,,,
,,,,,Torture Museum,,,Youd think one museum about torture would be enough but no not in Amsterdam However this was the first torture museum in the city centre and is at least somewhat more authentic than the copycat The museum depicts the history of different torturous techniques used over the centuries The lighting is bad the corridors are small and the price an absolute ripoff You can walk through it in 1530 minutes,52.36732,,nails 36 tanning 19 waxing 8 skincare 4 spa 3 pedicure 1  1 eyelashnails 1 hairremovalskincare 1 cosmetics 1 X X,,,,,Amsterdam Nail Art Studio,,,Singel 449,,,,,nails,beauty,,,4.890555,,10002300,,,,httpwwwtorturemuseumcom,,,,,do,31 20 3206642,,,€7,,,,Museum,,,,,,,This activity would be categorized as cheap,,,,,,,,,,,
12,Spui,,,,Spui,,,Every Friday and Sunday a market is held on the Spui Friday has books on sale while Sundays are all about art and antiques,52.36881,,X X  X X yes 2234 limited 983 no 881,,,yes,,American Book Center,,1012XA,,,,,,,books,,,4.88971,,,,,,httpwwwdeboekenmarktophetspuinlindexphpen,,,,Mo 12002000 TuWe 10002000 Th 10002100 FrSa 10002000 Su 11001830,buy,31 20 625 5537,,,,httpswwwabcnl,,,,,,,,,,,,,,,,,,,,,
1,Waterlooplein,,,,Waterloopleinmarkt,,,A wellknown but fairly overrated market near the city hall Partly flea market partly alternative and second hand clothing and accessories More oriented towards tourists than to locals,52.36865,,X X   X yes 2234 limited 983 no 881,,,no,,Episode,,1011NV,,,,,,,secondhand,,,4.90119,,MSa until about 1700,,,,,,,,,buy,,,,,httpswwwepisodeeu,,,,,,,,,,,,,,,,,,,,,
12,Spui,,,,The American Book Center,,,Excellent shop for literature and books in the English language particularly on American culture,52.36904,,X X  X X yes 2234 limited 983 no 881,,,yes,,American Book Center,,1012XA,Spui 12,,,,,,books,,,4.8899,,M 12002000 TuW FSa 10002000 Th 10002100 Su 11001830,,,,httpwwwabcnl,,,,Mo 12002000 TuWe 10002000 Th 10002100 FrSa 10002000 Su 11001830,buy,31 20 625 5537,,,,httpswwwabcnl,,,,,,,,,,,,,,,,,,,,,
,,,,,Athenaeum Boekhandel,,,One of the most renowned book stores of Amsterdam because of its wide array of fiction and more academic titles It is very popular among local students however their study books are also interesting reading material for nongraduates They have a particular large selection of books in the humanities including history media language culture and international relations,52.36896,,X X X X yes 2234 limited 983 no 881,,,no,,Athenaeum Boekhandel,,,Spui 1416,,,,,,books,,,4.88906,,M 11001800 TuW Sa 09301800 Th 09302100 F 9301830 Su 12001730,,,,httpswwwathenaeumnlwinkelsathenaeum,,,,,buy,31 20 5141460,,,,,,,,,,,,,,,,,,,,,,,,,
,,,,,The Book Exchange,,,A secondhand bookstore specialising in English books and has a large selection with an especially good selection of travel writing detectives and SFfantasy,52.37013,,X X only 49 yes 39 no 13 X yes 2234 limited 983 no 881,,,no,,The Book Exchange,,,Kloveniersburgwal 58,,,,,,books,,,4.89732,,MSa 10001600 Su 11301600,,,,httpwwwbookexchangenl,,,,,buy,31 20 6266266,,,,,,,,,,,,,,,,,,,,,,,,,
152,Kalverstraat,,,,Waterstones,,Waterstones,Another good tip for English literature Prices on the high side but theres a good selection of fiction and childrens books They also have magazines newspapers and board games,52.36881,enWaterstones,X    X X   yes 2234 limited 983 no 881,,,limited,,Waterstones,,1012XE,Kalverstraat 152,,,,,,books,,httpswwwwaterstonescombookshopsamsterdam,4.89098,,MSa 09001900 Su 10301800,,,,httpwwwwaterstonescomwaterstoneswebnavigatedopPageID200010,,,,,buy,,,,Price High side,,,,,,,,,,,,,,,,,,,,,,
35,Nieuwendijk,,,,Gebr Niemeijer,,,Frenchstyle bakery with pastries croissants breads sandwiches all baked fresh on premises Open for breakfast and lunch eatin or takeaway Bring the kids and eat in the small playroom upstairs,52.378173,,yes 10 no 9   yes 3 X   X   X,,,,,Gebroeders Niemeijer,,1012MA,Nieuwendijk 35,,,,,,bakery,,,4.895704,,TuFr 08151830 Sa 08301700 Su 09001700,,yes,,httpwwwgebroedersniemeijernl,,,,,eat,31 20 7076752,,,€611,httpswwwgebroedersniemeijernl,Brunch,No,,,,,,,Familyfriendly,Cheap,,,,,,,,,,,
183,Nieuwendijk,,,,Van der Linde,,,Known for its whipped cream,52.374908,,X X X    yes 72 no 22 unisex 2 yes 2234 limited 983 no 881,,,no,,Banketbakkerij Van der Linde,,1012MG,Nieuwendijk 183,,,,,,bakery,,,4.89424,,M 13001700 TuTh 11001745 F 09001745 Sa 09001700 Su 12001700,,,no,,,,,,eat,31 20 6248213,,,A small ice cream costs €1 a big one €2,,Dessert,No,,,,,,,Casual,"Based on the prices provided
 Small ice cream €1 Cheap
 Big ice cream €2 Cheap",,,,,,,,,,,
2,Nieuwendijk,,,,ZomerijsWinterkost,,,ZomerijsWinterkost means summer ice cream and winter food They have all the flavors you can think of and can even make a flavor on demand but you have to tell the owner one or two days in advance All the ice cream is homemade with natural ingredients for a reasonable price In the winter typical Dutch winter food is served like mashed potatoes with cabbage and smoked sausage,52.37884,,X X X yes 509 no 131 only 16 terrace 12 pedestrianzone 11 sidewalk 6 patio 1   X yes 2234 limited 983 no 881,,,no,,Joselito Tapas,,1012MK,Nieuwendijk 4,,,,spanish,,,,,4.89461,,,,,,,,,,,eat,,restaurant,,,httpsjoselitonl,Dinner,This is a type of 3star Micheline experience,,,,,,,Casual,,,,,,,,,,,outdoor,
60,Zeedijk,,,,Bird,,,Very crowded little snack bar with Thai food Not to be confused with the restaurant of the same owner on the other side of the street Try the chicken in oyster sauce,52.37477,,X X   yes 2234 limited 983 no 881,,,no,,Bonne,,1012BA,Zeedijk 72,,,,,,clothes,,,4.9008,,13002200 daily,,,,httpwwwthaibirdnl,,,,,eat,31 20 6201442,,,€1217,,Lunch,No,,,,,,,Casual,Based on the price range of €1217 for a meal this would be categorized as a cheap option,,,,,,,,,,,
60,Zeedijk,,,,KamYin,,,KamYin is a remarkably popular ChineseSurinamese restaurant because of its low prices and superfast service The food is absolutely delicious and some menus go for as low as €6 Service is nearly instant But dont expect a romantic setting Coke is handed out in cans its very noisy and the lighting is unflattering The area near the window gives a bit of a quieter atmosphere than the back so come early for a better seat However dont judge this place for something it doesnt try to be for a cheap and fast joint its unmatched Try the Sichuan Peking Duck if youre into Chinese and into spicy food or the nasi moksi meti chicken pork and rice for Surinamese Wash it down with a Fernandes Surinamese soft drink,52.37477,,X X   yes 2234 limited 983 no 881,,,no,,Bonne,,1012BA,Warmoesstraat 68,,,,,,clothes,,,4.9008,,,,,,,,,,,eat,31 20 6253115,,,€712,,Dinner,No,,,,,,,Casual,Cheap,,,,,,,,,,,
115117,Zeedijk,,,,New King,,,Slowly becoming an institution this hugely popular Mandarin Chinese restaurant seems to have found a perfect balance between food price and ambiance The food is authentically Chinese delicious fresh and quickly served and all of that for a bargain Service is fast and rushed but it doesnt feel like a snack bar It has a stylish interior and its still one of those places you could bring a date to The biggest problem is that everyone seems to know this place so its somewhat crowded and noisy and youll probably have to wait outside for a seat to become available When you get in order the oysters Theyre a hit,52.37362,,X X X  yes 2234 limited 983 no 881,,,no,,New King,,1012AV,Zeedijk 115,,,,chinese,,,,,4.90028,,11002230 daily,,,,httpwwwnewkingnl,,,,,eat,31 20 625 2180,restaurant,,€1520,,,3 star,,,,,,,Chic,Based on the price range of €1520 for a meal this would typically be categorized as a mediumpriced option,,,,,,,,,,,
1,Binnen Bantammerstraat,,,,OCHA,,,This used to be just the little Thai snackbar around the corner but since a raving review in the local newspaper Het Parool big crowds are waiting in line to get seated during dinnertime The scenery is simple and the restaurant is very small and cramped However the hype is all about the food which is absolutely mouthwatering They have the usual Thai fare but the dish to go for is the massaman curry their specialty,52.37404,,X X   X X  yes 2234 limited 983 no 881,,,no,,OCha,,,Binnen Bantammerstraat 1,,,,thai,,,,,4.90185,,TuSu 16002230,,,,,,,,TuSu 16002200,eat,31 20 625 9958,restaurant,,€15,,Dinner,3 star,,,,,,,Casual,This place is categorized as medium priced,,,,,,,,,,,vegan and vegetarian
49,Warmoesstraat,,,,Pasta Pasta,,,Serves delicious pastas made just as you want them Choose a sauce topping and pasta for a tasty but wellpriced meal,52.3753879,,X X wlan 431 yes 64 no 20 X    X,,,,,Pasta Pasta,,1012HW,Warmoesstraat 49,,,,italian,,,,,4.8983495,,SuTh 11000100 F Sa 11000300,,,,httpswwwfacebookcompagesPastaPastaAmsterdam170100713173330,wlan,,,,eat,31 20 331 1199,restaurant,,€490,httpspastapastanl,Dinner,No星,,,,,,,Casual,Cheap,,,,,,,,,,,
26,Oudebrugsteeg,,,,Rapper,,,Offers delicious sandwiches in freshly baked wraps and salads with a selection of home sauces Prices vary from €395 for vegetarian wrap to €595 for BlackAngus Entrecôte wrap,52.37604,,X X,,,,,De Kroon,,1012JP,30 Oudebrugsteeg,,,,,,cannabis,,,4.89597,,,,,,,,,,,eat,,,,"Vegetarian wrap €395
 BlackAngus Entrecôte wrap €595",,Lunch,No,,,,,,,Casual,This place would be categorized as cheap based on the price ranges provided,,,,,,,,,,,
23,Peperstraat,,,,Greetje,,,Traditional Dutch alongside French classics Located in an historic building on a quiet side street near Central Station its off the beaten track so most of the diners are local Open 6 days a week not Mondays a reservation is usually necessary,52.371581,,X X X   yes 2234 limited 983 no 881,,,yes,,Greetje,,1011TJ,Peperstraat 2325,,,,DutchFrench,,,,,4.907678,,,,,,httpwwwrestaurantgreetjenl,,,,,eat,31 20 7797450,restaurant,,,,Dinner,No,,,,,,,Intimate,,,,,,,,,,,,
291B,Spuistraat,,,,Kantjil  de Tijger,,,Great spices and meat dishes IndianIndonesian food Try the Nasi Goreng Rames,52.36924,,X X X    X yes 2234 limited 983 no 881,,,yes,,Kantjil  De Tijger,,1012VS,Spuistraat 291,,,,indonesian,,,,,4.88909,no,,,,,,,,,,eat,,restaurant,,,httpskantjilnl,Dinner,No,,,,,,,Intimate,,,,,,,,,,,,
4,Jodenbreestraat,Rembrandt House,,,Rembrandt Corner,,,The house where Rembrandt van Rijn lived,52.369426,,X  X  yes 82 no 18 EUR 24 2 adults camper 2 first hour and restaurant free €2hour€8day€5extra night 1 X         X    X yes 2234 limited 983 no 881,nlRembrandthuis,,limited,,Rembrandthuis,Museum not fully accessible  but the exhibitions are accessible by lift,1011NK,Jodenbreestraat 2,,,,,,,CategoryRembrandt House Museum,,4.901157,yes,,,,,,,,,TuSu 10001800,eat,31 20 520 0400,museum,,,httpswwwrembrandthuisnl,,No,,,,,,,Intimate,,,,,,,,,,,,
15,Jodenbreestraat,,,,Tonys NY City Bagels,,,Oversized cups of coffee muffins and bagels Muffins brownies giant cookies cheesecake and bagels spread with various toppings are served at reasonable prices to a clientèle that is a mix of locals and tourists American themed There are 3 locations in the city,52.369082,,X X yes 217 no 4 X X yes 509 no 131 only 16 terrace 12 pedestrianzone 11 sidewalk 6 patio 1    yes 72 no 22 unisex 2  yes 2234 limited 983 no 881,,,limited,,Tonys New York City Bagels,,1011NG,Jodenbreestraat 15,,,,american,,,,,4.903025,yes,,,,yes,httpwwwtonysnycitybagelsnl,,,,MoFr 08001800 Sa 08301800 Su 09001300,eat,31 20 421 5930,cafe,,,,Breakfast,No,,,,,,,Casual,,,,,,,,,,,indoor and outdoor,
,,,,,Samhoud Places,,,This modern place was recently awarded with 2 Michelin stars making it one of only 2 restaurants in Amsterdam to claim that recognition Excellent service high quality modern cooking and although perhaps subject to taste a contemporary design interior Wednesdays to Sundays it also serves lunch Closed on Mondays Call ahead,,,,,,,,,,,Oosterdokskade 5,,,,,,,,,,,,,,,httpwwwsamhoudplacescom,,,,,eat,31 20 2602094,,,€130 for 3 courses,,Lunch,2 star,,,,,,,Chic,This place would be categorized as expensive,,,,,,,,,,,
457,Singel,,,,Blue,,,The selling point of this cafe is its 360 degrees view over Amsterdam Its interior is minimalist and stylish A great place to have a Dutch cup of coffee while taking in the views Unfortunately its only open at daytime as evenings are reserved for private events,52.367425,,X   X   X  X yes 2234 limited 983 no 881,nlKalverpassage,,yes,,Kalverpassage,,1012WP,3F Kalvertoren Singel 457,,,,,,mall,,,4.891445,yes,M 11001830 Tu W F Sa 10001830 Th 10002100 Su 12001830,,,,httpwwwblueamsterdamnl,,,,,drink,31 20 4273901,yes,Kalvertoren,,httpswwwkalverpassagenl,,,,,,,Coffee,Ambient,Chic,,,,,,,,,,,,
20,Nieuwe Doelenstraat,,,,De Jaren,,,A minimal artdeco interior next to Hotel dEurope and a great view of where all the main canals come together climb the stairs to the upper floor  the view is better and the crowds surprisingly thinner Food is middling and on the pricy side but its a nice place to sip a cup of coffee or tea and read a newspaper,52.36803,,X  wlan 431 yes 64 no 20  X X yes 509 no 131 only 16 terrace 12 pedestrianzone 11 sidewalk 6 patio 1 X yes 2234 limited 983 no 881,nlDe Jaren,,no,,De Jaren,,1012CP,Nieuwe Doelenstraat 2022,,,,,,,,,4.89524,,,,,,httpwwwcafedejarennl,yes,,,MoSu 09002300,drink,31 20 6255771,restaurant,,Price pricy,httpswwwcafedejarennl,,,,,,,Coffee,Jazz,Casual,Im sorry but I need the specific price of the drink in order to categorize the place as cheap medium or expensive Can you please provide the exact price in euros,,,,,,,,,,outdoor,vegetarian
124,Valkenburgerstraat,,,,Filter,,,Small ecofriendly coffeebar situated in the lobby of hotel Ecomama Serves great coffee breakfast and a small selection of sweet and savoury treats Also organic tea juice and the best grilledcheese sandwiches Have a relaxed morning on the sunny terrace or enjoy art by starting Dutch artists,52.36971,,X     X,,,,,Ecomama,,1011NA,Valkenburgerstraat 124,,,,,,,,,4.90692,,8001700,,,,httpwwwfilteramsterdamnl,,,,,drink,31 20 770 9529,hostel,,,httpswwwecomamahotelcom,,,,,,,Coffee,Relaxed,Casual,,,,,,,,,,,,
4,Dijksgracht,,recommended,,Hannekes Boom,,,One of Amsterdams hidden secrets Hannekes Boom is a cosy somewhat ramshackle bar with a waterfront along the IJ Its a great place to just hang out and have a beer Not for clubbers but for those looking for a relaxing underground atmosphere and live music It is centrally located but off the tourist path so it has a local feel to it Outdoor seating is available but you have to order your drinks inside If you want to eat make a reservation in advance though the food is nothing special,52.37626,,X X X X yes 509 no 131 only 16 terrace 12 pedestrianzone 11 sidewalk 6 patio 1  yes 36 recommended 14 required 8 no 4   X yes 2234 limited 983 no 881,,,limited,,Hannekes Boom,,1019BS,Dijksgracht 4,,,,international,,,,,4.91155,,SuTh 11000100 F Sa 11000300,,,,httpwwwhannekesboomnl,,,,MoThSu 11000100 FrSa 11000300,drink,31 20 419 9820,restaurant,,,httpshannekesboomnl,,,,,,,Beer,Live,Intimate,,,,,,,,,,,outdoor,
,,,,,Brouwerij de Prael,,,A brewery tasting room and beer shop all in one,52.37534,,X X,,,,,Brouwerij De Prael,,,Oudezijds Voorburgwal 2630,,,,,,,,,4.89964,,Beer shop 12001900 tasting room TuSa 12002400 Su 12002300,,,,httpdepraelnl,,,,,drink,31 20 4084469,bar,,Brewery tour €750 or €1650 beer tasting with four beers €10,,,,,,,,Beer,None,Casual,The brewery tour for €750 would be considered cheap the beer tasting with four beers for €10 would be considered medium and the brewery tour for €1650 would also be considered medium,,,,,,,,,,,
3,Raamsteeg,,,,Cracked Kettle,,,This beer wine and spirits shop carries independent unique and rare bottles The staff are friendly but the space is quite confined and obtaining bottles from the very top shelves requires assistance and a dust rag,52.37017,,X X   yes 2234 limited 983 no 881,,,no,,Scissorhands,,1012VZ,Raamsteeg 3,,,,,,hairdresser,,,4.8887,,12002200 daily,,,,httpwwwcrackedkettlecom,,,,,drink,,,,,,,,,,,,wine,None,Casual,,,,,,,,,,,,
125,Paleisstraat,,,,De Bierkoning,,,Not a café but a supermarket specialized in beer It has over a thousand beers about half of it Dutch,52.37229,,wine 2 beer 1 coffee tea 1  X X  X   X yes 2234 limited 983 no 881,,,yes,,De Bierkoning,,1012ZL,Paleisstraat 125,,,,,,alcohol,,,4.88987,,,,,,httpwwwdebierkoningnl,,,,MoSa 11001900 Su 13001800,drink,31 20 625 2336,,,,httpsbierkoningnl,,,,,,,beer,None,Casual,,,,,,,,,,,,
1B,Kolksteeg,,,,In De Wildeman,,,A very well stocked beer café or actually beer tasting room bierproeflokaal in the centre of the inner city 17 beers usually from various countries and a cider on draught and about 250 different bottled beers offered There is no music played which makes for a very friendly and talkative atmosphere and it has a separate nonsmoking room,52.37617,,X X,,,,,QQ,,1012PT,Kolksteeg 3,,,,,,convenience,,,4.89513,,,,,,httpwwwindewildemannl,,,,,drink,31 20 6382348,,,,,,,,,,,Beer,,Casual,,,,,,,,,,,,
21,Damstraat,,,,Wynand Fockink,,,Wynand Fockink is a distillery that started in 1679 They offer distillery tours but you must reserve at least a week in advance as they fill up quickly It is also a tasting room and a liquor store They have numerous liquors brandies and jenevers and encourage you to try them all It is traditional to stoop and sip the first drink and not spill Great liquors and a good time in the back alleys of Amsterdam,52.37224,,X X   yes 2234 limited 983 no 881,,,limited,,Carne Argentina,,1012JL,Pijlsteeg 31,,,,,,,,,4.89537,,,,,,httpwwwwynandfockinknl,,,,,drink,31 20 6392695,restaurant,,,,,,,,,,spirits,Traditional folk,Casual,,,,,,,,,,,,
2,Gravenstraat,,,,Belgique,,,One of the smallest bars in Amsterdam there is seating for at most 15 people Specialising in Belgian beers extensive menu that includes some hard to find beers on tap This place is smoke friendly so dont be surprised to see people rolling joints as they drink,52.37434,,X yes 6 various 2 Heineken 1 Grolsch 1 Bavaria 1 variouslocal 1 Amstel 1 Asahi 1 breweryhertogjan 1 yesvarious 1  X  X X   X,,,,,Café Belgique,,1012NM,Gravenstraat 2,,,,,,,,,4.89304,,14000100 daily,,,,httpcafebelgiquenl,,,,SuWe 16002300 ThSa 16000100,drink,31 20 6251974,pub,,,httpswwwcafebelgiquenl,,,,,,,Beer,Bar,Intimate,,,,,,,,,,,,
,,,,,Cuba,,,Great bar really nice atmosphere close to the Red Light District with a nice terrace in the summer Selection of cheap cocktails and long island ice tea,52.37268,,X X,,,,,Café Cuba,,,Nieuwmarkt 3,,,,,,,,,4.90106,,,,,,,,,,,drink,,cafe,,,,,,,,,,cocktail,Bar,Casual,,,,,,,,,,,,
4,Raamsteeg,,,,Gollem,,,A special beer café serving many beers especially from Belgium Germany Czech Republic and other countries,52.37029,,X yes 1 X X yes 2234 limited 983 no 881,,,no,,Cafe Gollem,,1012VZ,Raamsteeg 4,,,,,,,,,4.88869,,,,,,httpwwwcafegollemnl,,,,,drink,31 6 53780273,pub,,,httpscafegollemnl,,,,,,,beer,Jazz,Casual,,,,,,,,,,,,
5,Nieuwe Doelenstraat,,,,Katoen,,,Close to the southern part of the Canal District Alternative music and cosy atmosphere also in the evenings,52.36782,,X    yes 2234 limited 983 no 881,,,no,,Hotel Résidence Le Coin,,1012CP,Oude Turfmarkt 153,,,,,,,,,4.89408,,,,,,httpcafekatoennlen,,,,,drink,31 20 6262635,hotel,,,,,,,,,,Beer,Alternative,Intimate,,,,,,,,,,,,
11,Oudezijds Kolk,,,,Molly Malones Irish Pub,,,Authentic Irish pub with food Mix of expatriates locals and tourists friendly staff Situated on a canal off the Zeedijk close to Centraal Station and Warmoesstraat Open every night live music in the weekends and largescreen television,52.37612,,X    yes 2234 limited 983 no 881,,,limited,,France hotel,,1012AL,Oudezijds Kolk 9,,,,,,,,,4.90148,,,,,,httpwwwmollyinamsterdamcom,,,,,drink,31 20 6241150,hotel,,,,,,,,,,Beer,Irish folk,Casual,,,,,,,,,,,,
189,Spuistraat,,,,Schuim,,,The super comfy cafe is a great place to spend entire rainy days at a time It heats up quite a bit at night Pot smoking seems to be tolerated even though Schuim is definitely not a coffeeshop,52.37209,,X   X X no 149 outside 100 isolated 7 separated 7 dedicated 3 yes 1  yes 2234 limited 983 no 881,,,yes,,Schuim,,1012VN,Spuistraat 189,,,,,,,,,4.88963,no,,,,,,,,outside,SuTh 12000100 FrSa 12000300,drink,31 20 6389357,pub,,,,,,,,,,Coffee,Ambient,Casual,,,,,,,,,,,,
2563,Nieuwezijds Voorburgwal,,,,Speijk,,,Awesome bar with lost of fun artsy crazy locals Various DJ play different styles Open till late in the morning Best place to meet laidback and awesome Amsterdammers,52.37182,,X  X X    X yes 2234 limited 983 no 881,,,no,,Diep,,1012RS,Nieuwesijdsvoorburgwal 260,,,,,,,,,4.89033,,,,,,,,,,SuTu Th 17000100 We 09000100 FrSa 17000300,drink,31 20 420 2020,cafe,,,httpscafediepbusinesssite,,,,,,,Beer,Electronic,Casual,,,,,,,,,,,,
83,Rokin,Cafe de Paris,,,The Tara Irish Pub,,,Quite a large Irish pub but it feels homey and cosy The crowd is fairly mixed with expats tourists and the occasional local student Two pool tables are available Bar food is served but its rather expensive and portions are small,52.370349,,X X   yes 2234 limited 983 no 881,,,no,,Café de Paris,,1012KL,Rokin 8589,,,,,,,,,4.893094,,SuTh 11000100 FSa 11000300,,,,httpwwwthetaracom,,,,,drink,31 20 4212654,restaurant,,,,,,,,,,Beer,Irish,Casual,,,,,,,,,,,,
